,number,value,params_freeze,params_gamma,params_lr,params_modelname,params_nd1,params_nd2,params_nd3,params_step_size,state
0,0,5.238158702850342,3,8,2.0730233545788777e-05,effv2s,3,7,9,15,COMPLETE
1,1,4.333930969238281,1,10,0.00011280974386135849,resnet34,6,5,9,17,COMPLETE
2,2,6.321488380432129,-1,6,0.0026485694841211255,resnet34,4,4,4,16,COMPLETE
3,3,8.25861644744873,4,9,0.009356517195848853,resnet34,9,7,10,23,COMPLETE
4,4,4.5916314125061035,3,9,2.155692281592679e-05,resnet34,7,7,5,16,COMPLETE
5,5,4.2629241943359375,2,9,0.0006297343379624366,resnet18,10,3,6,15,COMPLETE
6,6,7.69381856918335,0,7,0.0003311717470434866,effv2s,6,4,4,27,COMPLETE
7,7,4.818901062011719,3,10,0.00032837775034736457,effv2s,5,10,7,30,COMPLETE
8,8,7.849039554595947,0,10,0.0032872931922508586,resnet18,7,10,8,29,COMPLETE
9,9,4.7102789878845215,0,7,6.0980289954545565e-05,resnet34,6,6,5,16,COMPLETE
10,10,4.287472248077393,2,5,0.000806139574304052,resnet18,10,3,6,20,COMPLETE
11,11,4.2044901847839355,2,5,0.0009860372554429916,resnet18,10,3,6,20,COMPLETE
12,12,4.732301712036133,2,5,0.0011155099472830387,resnet18,9,3,7,20,COMPLETE
13,13,4.803426742553711,1,8,0.0011513451062220691,resnet18,10,5,3,20,COMPLETE
14,14,4.522561550140381,2,6,0.00019504188759238112,resnet18,8,3,6,23,COMPLETE
15,15,8.727546691894531,4,9,0.0006162512702496365,resnet18,9,5,5,18,COMPLETE
16,16,7.240307331085205,1,6,0.0040408957812253,resnet18,10,9,8,25,COMPLETE
17,17,4.893758773803711,3,8,7.9800510617102e-05,resnet18,8,4,6,19,COMPLETE
18,18,4.3700785636901855,2,7,0.0019882507337501756,resnet18,9,8,7,22,COMPLETE
19,19,5.125430583953857,1,5,0.00647698379440228,resnet18,8,6,3,25,COMPLETE
20,20,5.040261745452881,-1,9,0.0005364051032222356,effv2s,10,4,8,18,COMPLETE
21,21,4.789302825927734,2,5,0.0010907971435534767,resnet18,10,3,6,21,COMPLETE
22,22,4.315169811248779,2,6,0.0006553815810114972,resnet18,10,3,6,19,COMPLETE
23,23,4.84745979309082,3,5,0.0001690480802014295,resnet18,9,3,5,25,COMPLETE
24,24,4.193431377410889,2,5,0.0014341245404192995,resnet18,8,4,4,21,COMPLETE
25,25,4.387259006500244,1,6,0.0016017580945088237,resnet18,8,4,4,22,COMPLETE
26,26,4.683194160461426,3,7,0.0004380375005377922,resnet18,7,5,4,24,COMPLETE
27,27,5.31953239440918,2,5,0.00477395980984432,resnet18,9,4,3,27,COMPLETE
28,28,8.580082893371582,4,8,0.001928526069181408,resnet18,8,6,5,15,COMPLETE
29,29,4.427544116973877,3,6,0.00021289328951814692,effv2s,3,5,7,21,COMPLETE
30,30,5.002869129180908,1,8,3.427827597710061e-05,effv2s,9,3,9,15,COMPLETE
31,31,4.6193060874938965,2,5,0.0008815813642869602,resnet18,10,3,6,20,COMPLETE
32,32,4.337733268737793,2,5,0.0007867164442281997,resnet18,10,4,6,18,COMPLETE
33,33,4.827301979064941,2,5,0.0018874405630111724,resnet18,10,3,5,17,COMPLETE
34,34,4.550578594207764,1,6,0.0003944454215131646,resnet34,9,4,4,21,COMPLETE
35,35,4.792365074157715,2,6,0.0025769399827248385,resnet18,5,3,7,19,COMPLETE
36,36,4.781351089477539,3,9,0.001397094131873477,resnet34,10,5,5,17,COMPLETE
37,37,4.696919918060303,1,10,0.0008333850574858248,resnet18,8,4,10,22,COMPLETE
38,38,4.801445484161377,0,5,1.1525481407386887e-05,resnet18,7,8,8,23,COMPLETE
39,39,4.358427047729492,3,7,0.00026690813573765614,resnet34,9,3,7,16,COMPLETE
40,40,14.603368759155273,4,9,0.0001302221231027799,effv2s,4,4,9,20,COMPLETE
41,41,4.086881637573242,2,6,0.0006389314029745485,resnet18,10,3,6,19,COMPLETE
42,42,4.536388397216797,2,5,0.0004832133935016545,resnet18,10,3,6,21,COMPLETE
43,43,22.61609649658203,2,6,0.0011946783604785361,resnet18,9,3,6,19,COMPLETE
44,44,4.203744411468506,2,5,0.00030757524029659955,resnet18,10,4,4,18,COMPLETE
45,45,4.252782344818115,2,5,0.0002711078614621442,resnet18,10,4,4,17,COMPLETE
46,46,4.758301734924316,3,5,0.00028436175385939793,resnet18,9,4,4,18,COMPLETE
47,47,4.246061325073242,1,6,9.056226813936444e-05,resnet18,10,5,3,17,COMPLETE
48,48,4.371264934539795,1,6,5.973321399849465e-05,resnet34,6,5,3,16,COMPLETE
49,49,5.004395008087158,0,6,9.858711778316539e-05,resnet18,5,6,3,17,COMPLETE
50,50,4.4321370124816895,1,7,3.838415483176377e-05,resnet18,10,5,3,19,COMPLETE
51,51,3.9297266006469727,2,5,0.00035482138908674563,resnet18,10,4,4,17,COMPLETE
52,52,4.348304748535156,1,5,0.0003780421049556509,resnet18,10,4,3,18,COMPLETE
53,53,4.722715377807617,2,5,0.00014042519247432794,resnet18,9,4,4,17,COMPLETE
54,54,4.7296953201293945,2,5,0.0025280778986867653,resnet18,10,5,5,20,COMPLETE
55,55,4.695866107940674,1,6,0.0005689882955882801,resnet18,10,6,4,16,COMPLETE
56,56,4.286279201507568,2,6,9.015655761413859e-05,resnet18,9,7,4,18,COMPLETE
57,57,4.728658676147461,3,5,0.00018581851075876788,effv2s,10,4,3,19,COMPLETE
58,58,4.537543773651123,0,5,6.400508553221963e-05,resnet18,8,5,4,18,COMPLETE
59,59,4.367068290710449,2,7,0.001031548368604,resnet18,7,3,5,21,COMPLETE
60,60,4.665090084075928,1,6,0.0007267747589813271,resnet18,9,4,3,20,COMPLETE
61,61,4.1739912033081055,2,5,0.00026110475019016494,resnet18,10,4,4,17,COMPLETE
62,62,4.058143615722656,2,5,0.00034184622490596807,resnet18,10,4,4,17,COMPLETE
63,63,4.266818046569824,2,5,0.0002308982413997386,resnet18,10,4,5,15,COMPLETE
64,64,4.480234622955322,2,5,0.0003601710246055457,resnet18,10,3,4,16,COMPLETE
65,65,4.419121742248535,2,5,0.00048014988698301,resnet18,10,3,5,19,COMPLETE
66,66,3.9737439155578613,2,5,0.0005934057233027319,resnet18,9,4,4,18,COMPLETE
67,67,4.4695258140563965,2,5,0.00033150266679653694,resnet18,9,4,4,16,COMPLETE
68,68,4.471384525299072,3,5,0.00015827522828957427,resnet34,9,5,4,18,COMPLETE
69,69,4.779697895050049,2,5,0.00023644554916162812,resnet18,8,4,4,17,COMPLETE
70,70,4.915935039520264,3,5,0.0006377462362250816,effv2s,9,8,4,19,COMPLETE
71,71,22.613101959228516,2,5,0.0014293382962666354,resnet18,10,3,5,18,COMPLETE
72,72,4.343589782714844,2,5,0.0009170982345652877,resnet18,10,4,4,20,COMPLETE
73,73,4.686137676239014,2,5,0.00042359252953319543,resnet18,10,4,5,19,COMPLETE
74,74,4.229927062988281,2,5,0.0005427007966037572,resnet18,9,3,4,18,COMPLETE
75,75,4.4341139793396,2,5,0.0006712498558190901,resnet18,10,3,5,17,COMPLETE
76,76,4.8989644050598145,3,6,0.00030761469291149684,resnet18,10,10,4,22,COMPLETE
77,77,4.911089897155762,2,5,0.00044536034779092345,resnet18,9,4,5,20,COMPLETE
78,78,4.43495512008667,2,5,0.0013201998420985356,resnet18,10,5,7,30,COMPLETE
79,79,4.870608806610107,2,5,0.001721643238117841,resnet18,8,4,6,15,COMPLETE
80,80,43.888980865478516,3,6,0.0009973278661173737,resnet18,9,3,3,21,COMPLETE
81,81,5.148214817047119,2,5,0.0005202749384092682,resnet18,10,3,4,18,COMPLETE
82,82,4.181276798248291,2,5,0.0007813570091733239,resnet18,9,3,4,17,COMPLETE
83,83,5.482536792755127,2,5,0.0007848242051145841,resnet18,10,3,4,16,COMPLETE
84,84,4.742689609527588,2,5,0.00034644819078580606,resnet18,9,4,4,17,COMPLETE
85,85,4.202406406402588,2,5,0.00020031227610386684,resnet34,8,3,4,17,COMPLETE
86,86,4.2551164627075195,2,5,0.0002177908002438918,resnet34,8,3,4,17,COMPLETE
87,87,4.423652172088623,2,6,0.0002977038269242912,resnet34,7,4,3,16,COMPLETE
88,88,4.255349159240723,2,5,0.00016821994096854833,resnet34,8,4,3,17,COMPLETE
89,89,4.057555198669434,1,5,0.00012406926120014382,resnet34,7,9,4,16,COMPLETE
90,90,4.385488510131836,1,5,0.00011564100021981796,resnet34,7,9,4,15,COMPLETE
91,91,4.944972038269043,1,5,0.0002480178015283188,resnet34,6,9,4,16,COMPLETE
92,92,4.357178211212158,2,5,0.00014165563784244566,resnet34,8,7,4,17,COMPLETE
93,93,4.557287693023682,1,5,0.00020032122963505302,resnet34,7,8,4,29,COMPLETE
94,94,4.163703441619873,2,5,0.00011311391288300463,resnet34,8,4,5,18,COMPLETE
95,95,4.766452789306641,2,5,6.954630539660381e-05,resnet34,8,5,5,17,COMPLETE
96,96,5.320072174072266,-1,5,0.00010316534424836463,resnet34,8,3,5,16,COMPLETE
97,97,4.458126068115234,2,6,5.2557916775049307e-05,resnet34,8,3,5,18,COMPLETE
98,98,4.115455150604248,1,5,0.00011320713301728515,resnet34,7,6,4,24,COMPLETE
99,99,4.8137383460998535,1,5,0.008966219294071535,resnet34,7,6,3,24,COMPLETE
